0,300456.SZ,微电子器件、半导体器件、集成电路及配套产品的技术开发、技术服务、软件开发、技术咨询；产品设计；集成电路设计； 制造电子计算机软硬件；销售微电子器件、半导体器件、通讯设备及其系统软件、计算机软件、电子计算机及其辅助设备、电子元器件；货物进出口，技术进出口，代理进出口。（市场主体依法自主选择经营项目，开展经营活动；依法须经批准的项目，经相关部门批准后依批准的内容开展经营活动；不得从事国家和本市产业政策禁止和限制类项目的经营活动。）,3
5,300750.SZ,锂离子电池、锂聚合物电池、燃料电池、动力电池、超大容量储能电池、超级电容器、电池管理系统及可充电电池包、风光电储能系统、相关设备仪器的开发、生产和销售及售后服务；对新能源行业的投资；锂电池及相关产品的技术服务、测试服务以及咨询服务。(依法须经批准的项目，经相关部门批准后方可开展经营活动),5
6,300461.SZ,生产销售自动化设备、自动化系统、自动化机械及电子部件、机械部件；对自产产品提供售后维修服务。,2
11,300290.SZ,许可经营项目：第二类增值电信业务中的信息服务业务（不含固定网电话信息服务和互联网信息服务）；一般经营项目：计算机软硬件技术、电控工程技术开发；计算机系统集成（持资质证经营）及咨询服务，计算机及辅助设备、通讯器材、机械电子设备销售，建筑智能化工程、防雷电工程、安全技术防范设施工程、弱电工程设计、施工，计算机房装修及综合布线（上述项目持资质证经营），计算机系统维护， 多媒体教学设备、特教仪器设备、教学器材、医疗器械销售； 自营和代理各类商品和技术的进出口，但国家限定公司经营或禁止进出口的商品和技术除外。（依法须经批准的项目，经相关部门批准后方可开展经营活动。）,1
17,300250.SZ,计算机软件、办公自动化设备、光纤通讯设备、数据接入设备、视频通讯设备、综合网络管理及服务提升系统的技术开发、技术服务、成果转让，数字复合和传输接口设备、电视电缆和电力线传输设备、无源光传输设备、数据通信设备、移动数据终端设备、光电通信设备、接入网系统设备、数字网络机顶盒、通信系统设备的设计、生产、销售、 维修、 技术服务、技术咨询，计算机网络工程安装，信息系统集成，集成电路、通讯设备及零部件、电子产品、机械设备、仪器仪表、办公用品、计算机及外部设备、化工产品（除化学危险品及易制毒化学品）的销售，经营进出口业务。（依法须经批准的项目，经相关部门批准后方可开展经营活动),1
19,002902.SZ,研发、产销：半导体材料及器件、集成电路产品、微电子产品、光电产品、电子产品、网络通信磁性元器件、通信用连接器组件、光电模块、光器件、电源类产品、照明光源、灯具、日用小家电、五金制品、塑胶制品；研发、产销、维修保养：光伏逆变器和控制器、风能控制器、通信电源、不间断电源、储能电源、应急电源、蓄电池管理装置、通信用机柜及其配套产品、低压成套开关设备、网络通信终端、电动车充电器及充电桩；数据中心、通信系统、太阳能和风能供电系统的工程设计、集成、安装调测和保养； 道路普通货运；货物进出口、技术进出口。（依法须经批准的项目，经相关部门批准后方可开展经营活动）。,3
23,300545.SZ,一般经营项目：电子半导体工业自动化设备；光电平板显示（ LCD/LCM/TP/OLED/PDP）工业自动化设备、检测设备、其他自动化非标专业设备，口罩机的研发、生产与销售、调试安装及售后服务； 设施、工装夹具、工控软件的研发、设计、生产、销售和技术服务；货物及技术进出口； 劳保（口罩、防护服、手套）的生产与销售。（法律、行政法规、国务院决定规定在登记前须批准的项目除外）；许可经营项目：普通货运（不含危险货物运输及凭道路运输经营许可证经营）。,2
26,002912.SZ,通讯产品的技术开发、服务、咨询、购销。(凡涉及特许经营的项目须经有关部门批准后方可经营；不涉及的，企业自主选择项目开展经营活动)；从事货物、技术进出口业务(不含分销、国家专营专控商品)；投资咨询、企业管理咨询、商务信息咨询(以上均不含限制项目)；投资管理(不得从事信托、金融资产管理、证券资产管理、保险资产管理及其它限制项目)；生产通讯所涉及的宽带网络ATM、通讯雷达。,1
27,300270.SZ,应用软件的技术开发、技术服务、成果转让；计算机系统集成，安防工程的设计、施工，楼宇智能化工程的设计、施工，安防产品、通信产品、计算机软件的生产和销售；经营进出口业务；有形动产租赁业务、融资租赁业务、租赁业务。(依法须经批准的项目，经相关部门批准后方可开展经营活动),4
30,300348.SZ,计算机软、硬件及电子仪器的开发及服务，网络技术的开发及服务；兴办实业（具体项目另行申报）；国内商业、物资供销业（不含专营、专控、专卖商品）。计算机系统集成（不含限制项目）。信息技术咨询；信息系统设计、集成、运行维护；人力外包；劳务派遣。人才培训。自有房屋租赁。以承接服务外包方式提供系统应用管理和维护、信息技术支持管理、数据处理管理技术和业务流程外包服务；从事技术进出口业务经营。（依法须经批准的项目，经相关部门批准后方可开展经营活动）,1
33,300243.SZ,制造销售塑料助剂； 生物材料、降解塑料的树脂及制品的生产、研发和经营；合成橡胶制造和销售。 （依法须经批准的项目，经相关部门批准后方可开展经营活动）,0
34,300484.SZ,软硬件技术开发；变频器、伺服驱动器和系统、电动汽车电机控制器、太阳能光伏逆变器和水泵控制器、电子逆变焊机、电子加热装置、软起动器的研发、生产、销售、系统集成、技术咨询；兴办实业（具体项目另行申报）；国内贸易；经营进出口业务； 新能源汽车租赁服务（不含融资租赁） 、运营管理服务、 房屋租赁（以上均不含法律、行政法规、国务院决定规定需前置审批和禁止的项目） 。,5
36,300475.SZ,机器人核心零部件、家用电器核心零部件、模具的研发、生产、销售；房屋租赁；自营本公司产品和技术的进出口业务(国家限定公司经营或禁止进出口的产品和技术除外)(依法须经批准的项目，经相关部门批准后方可开展经营活动)。,2
43,300655.SZ,生产电子工业用超纯化学材料（硫酸、硝酸、盐酸、氢氟酸、乙酸［含量＞80%］、 2-丙醇、氟化铵、过氧化氢［ 20%≤含量≤60%］、氨溶液［ 10%＜含氨≤35%］ 及液体消毒剂【过氧乙酸（含餐具洗涤剂） [含量≤43%，含水≥5%，含乙酸≥35%，含过氧化氢≤6%，含有稳定剂]、过氧化氢】，开发生产电子工业用超纯化学材料，销售公司自产产品；从事一般化学品和危险化学品（按有效的《危险化学品经营许可证》所列项目及方式经营）的批发业务（不涉及国营贸易管理商品，涉及配额、许可证管理商品的，按国家有关规定办理申请）；提供相关技术服务、咨询和技术转让。（依法须经批准的项目，经相关部门批准后方可开展经营活动）（外资比例小于 25%）,0
53,002691.SZ,矿用采掘机械、矿用运输设备、矿用电器及仪表、风动设备、电动设备及配件、通讯设备及器材、钻具、锚具、锚固用品的生产销售、机械加工；本企业自产产品及技术的出口业务和本企业所需的机械设备、零配件、原辅材料及技术的进出口业务，国家限定或禁止的商品和技术除外；设备租赁；自产产品的维修服务，自有房屋租赁；煤炭销售。,2
54,002876.SZ,偏光片、保护膜、太阳膜的生产销售，光电材料的研发与销售，国内商业、物资供销业、货物及技术进出口(以上均不含法律、行政法规、国务院决定禁止及规定需前置审批项目)；普通货运(有效期至2011年9月30日)。,3
58,300312.SZ,通信设备、仪器仪表、计算机软件、电力输配电及控制设备、电工器材、电气机械、广播电视设备的技术开发、技术转让、技术咨询、技术服务、技术培训；批发通信设备、仪器仪表、计算机软件、硬件及辅助设备、电力输配电及控制设备、电工器材、电气机械、广播电视设备(不含卫星电视广播地面接收设施)；计算机系统服务；通信信息网络系统集成、通信用户管线建设；通信设备租赁；投资及投资管理；货物进出口、技术进出口。,4
60,300521.SZ,研究、开发激光、电压打印喷头技术、机械设备技术，生产打印设备及零配件，销售本企业产品，提供相关技术咨询、售后服务。从事机械设备及其相关零配件的批发、零售、进出口业务（不设店铺经营，不涉及国营贸易管理商品，涉及配额、许可证管理商品的，按国家有关规定办理申请）及技术进出口。 新技术有色金属材料生产，电子元器件零售、电子元器件批发，电子元件及组件制造，机械设备租赁、房屋租赁。,2
63,300773.SZ,银行卡收单；互联网支付；数字电视支付；预付卡受理；移动电话支付(中华人民共和国支付业务许可证有效期至2021年05月02日)；技术开发、技术咨询、技术转让、技术服务；计算机系统集成；设计、制作、代理、发布广告；销售自主研发的产品。(企业依法自主选择经营项目，开展经营活动；依法须经批准的项目，经相关部门批准后依批准的内容开展经营活动；不得从事本市产业政策禁止和限制类项目的经营活动。),1
64,300366.SZ,(以下范围不含前置许可项目，后置许可项目凭许可证或审批文件经营)互联网信息服务；软件和信息技术服务业；商品批发与零售； 增值电信业务。（ 依法须经批准的项目，经相关部门批准后方可开展经营活动）,1
68,300352.SZ,计算机系统服务；数据处理；基础软件服务；应用软件服务；计算机软硬件及通信设备的研发、技术推广、技术转让、技术培训、维修、咨询、服务、销售；计算机软硬件的生产、组装；复制记录媒介(不含出版物)；技术进出口、货物进出口、代理进出口；销售计算机信息系统安全专用产品、经国家密码管理局审批并通过指定检测机构产品质量检测的商用密码产品；经国家密码管理机构批准的商用密码产品的开发；第二类增值电信业务中的信息服务业务(不含固定网电话信息服务)。(企业依法自主选择经营项目，开展经营活动，第二类增值电信业务中的信息服务业务以及依法须经批准的项目，经相关部门批准后依批准的内容开展经营活动；不得从事本市产业政策禁止和限制类项目的经营活动。),1
72,300751.SZ,自动化设备及仪器研发、生产、销售及维修；各类新型材料研发、生产、销售；软件开发、销售；自营和代理各类商品及技术的进出口业务（国家限定企业经营或者禁止进出口的商品及技术除外）；自动化信息技术咨询。（依法须经批准的项目，经相关部门批准后方可开展经营活动）,2
75,300292.SZ,互联网数据产品的研发、互联网信息服务，数字营销服务；电子产品、计算机软硬件、物联网信息技术与相关产品的研发、销售，提供技术服务与系统集成；物联网信息工程、智能系统工程、电子工程的设计、施工及维护；通信设备及元器件的研发、生产与销售； 各类广告设计、制作、代理、发布，图文设计制作，企业形象策划，市场营销策划；通信业务代理、代维、运营及通信技术服务（特许经营的除外）； 自营和代理各类商品及技术的进出口业务（国家限定企业经营或禁止进出口的商品及技术除外）；实业投资。 第二类增值电信业务； （依法须经批准的项目，经相关部门批准后方可开展经营活动）,1
77,002706.SZ,许可项目： 各类工程建设活动。（ 依法须经批准的项目， 经相关部门批准后方可开展经营活动， 具体经营项目以相关部门批准文件或许可证件为准） 一般项目： 电器元件、成套设备及控制系统的研发、设计、制造、销售及技术服务， 智能家庭消费设备、 仪器仪表、 灯具、 照明器具、 电子产品的自动化设备销售， 从事智能科技、 安防科技、 建筑科技、 能源科技、 网络科技、 消防科技、 电子产品科技领域内的技术开发、 技术转让、 技术咨询、 技术服务， 人工智能行业应用系统集成服务、 工业设计服务， 合同能源管理， 机器设备的融物租赁，自有房屋的租赁，经营各类商品和技术的进出口（国家限定公司经营或禁止进出口的商品及技术除外）。（ 除依法须经批准的项目外， 凭营业执照依法自助开展经营活动）,5
78,002531.SZ,从事设计、生产加工各类电力设备(风力发电设备)、船舶设备、起重设备(新型港口机械)、锅炉配套设备，销售公司自产产品；并提供相关技术咨询、技术服务。,5
79,300451.SZ,物联网技术、数据处理技术、 信息技术的技术开发、技术咨询、技术服务，经营增值电信业务（凭许可证经营)， 医疗器械生产（详见《医疗器械生产企业许可证》），医疗器械经营（限批发，范围详见《中华人民共和国医疗器械经营企业许可证》） ， 电子计算机软件的技术开发、咨询及服务、成果转让，电子计算机的安装、维修，智能楼宇工程、电子与智能化工程、消防设施工程、机电安装工程、灯光工程、音响工程、舞台机械工程的设计、施工，电子计算机及配件的批发，经营进出口业务， 信息系统工程监理，接受金融机构委托从事金融信息技术外包，接受金融机构委托从事金融业务流程外包。（依法须经批准的项目，经相关部门批准后方可开展经营活动）,1
80,002649.SZ,信息技术开发、服务；计算机及相关设备软件的开发、设计、制作、测试、销售；为自产产品提供技术咨询和技术服务；计算机系统集成的设计、安装、调试、维护；以服务外包方式从事数据处理服务；企业管理咨询；信息技术培训；货物进出口、技术进出口、代理进出口。,1
81,002816.SZ,国内贸易（不含专营、专卖、专控商品）；经营进出口业务（法律、行政法规、国务院决定禁止的项目除外，限制的项目须取得许可后方可经营。）全系列超声波清洗机、高压喷洗机、碳氢化合物清洗机、电子玻璃平板清洗机、电子玻璃加工设备、工业纯水设备、中水回用设备和工程、污水处理设备和工程、废气处理设备和工程、电镀生产设备以及工控软件、嵌入式软件的开发、设计和销售、工业自动化设备、机器人及相关电子元器件和结构部件的生产加工。,2
82,300256.SZ,各种视窗防护屏、触控显示模组、新型显示器件及相关材料和组件的研发和制造；从事进出口业务。（依法须经批准的项目，经相关部门批准后方可开展经营活动）,3
85,300721.SZ,醇醚、醇醚醋酸酯系列产品的生产（按安全生产许可证所列范围经营）；危险化学品经营（按许可证所列范围和方式经营）；醇醚、醇醚醋酸酯系列产品（不含危险化学品）的生产；机动车制动液、汽车发动机冷却液产品的生产、销售；化工产品及原料（不含危险化学品）的销售；化工产品及其生产技术的研究、开发；自营和代理各类商品及技术的进出口业务（但国家限定企业经营或禁止进出口的商品和技术除外） ；售电业务。（依法须经批准的项目，经相关部门批准后方可开展经营活动）,0
88,300447.SZ,许可经营项目：无；一般经营项目：光电传输线缆及组件、光电器件、微波器件、计算机软硬件、电子信息系统和冷却产品的研发、生产、销售、转让、咨询、试验、技术服务；本企业自产产品原辅材料、配套器材和电工器材的生产、销售。,5
94,300835.SZ,磁性材料系列产品、直流电机及部件系列产品、扬声器系列产品以及相关电子产品的研发、生产、销售；经营本企业和本企业成员企业自产产品及相关技术的出口业务(国家限定公司经营或禁止出口的商品除外)；经营本企业或本企业成员企业生产、科研所需要的原辅材料、机械设备、仪器仪表、零配件及相关技术的进口业务(国家限定公司经营或禁止进口的商品除外)；经营来料加工和“三来一补”业务。,3
96,300219.SZ,电气机械和器材制造业（具体经营项目请登陆广州市商事主体信息公示平台查询。依法须经批准的项目，经相关部门批准后方可开展经营活动。）,3
99,300032.SZ,生产销售微电机和微电机组件、新型电子元器件及消费类电子；货物进出口和技术进出口(法律、行政法规限制和禁止的除外)。,3
100,002529.SZ,资源再生及综合利用技术，高新技术，新产品，比例、伺服液压技术开发；高技术复合材料(连续纤维增强热塑性复合材料和预浸料、树脂基复合材料、特种功能复合材料及制品、碳/碳复合材料及制品)生产；建材机械、建材、全自动液压压机生产；农业机械的生产、安装、调试、维修、销售及技术咨询。,2
105,002359.SZ,通信技术推广、技术开发、技术转让、技术咨询、技术服务；销售通信设备；租赁通信设备。本单位制造机械式停车设备安装、改造、维修(有效期限以许可证为准)生产销售铁塔、钢管塔、架构、管道和钢管柱及建筑用轻钢厂房、停车设备；本公司产品的出口业务及所需原材料的进口业务；公路标志、标线、护栏、隔离栅、防眩板工程施工及安装；机械式立体停车设备的维护及技术服务，承包与其实力、规模、业绩相适应的国外工程项目；备案范围内的进出口业务；经营电信业务。(依法须经批准的项目，经相关部门批准后方可开展经营活动。),4
113,300025.SZ,经营增值电信业务(凭许可证经营)。计算机软、硬件及系统集成技术开发、技术服务、成果转让，通信工程的承包，通信网络设备、通信配线设备的生产、销售、安装、租赁，计算机软硬件产品和网络测试产品的生产、租赁，通信信息网络系统集成服务，网络信息产品、机电产品、互联网设备、仪器仪表及配件的销售、租赁，经营进出口业务。(依法须经批准的项目，经相关部门批准后方可开展经营活动),4
115,002326.SZ,经公司登记机关核准，公司的经营范围：农药(不含危险化学品)的销售(凭许可证经营)。有机中间体(不含危险化学品和易制毒化学品)及其副产物(异丙醇、三苯基氧膦、氯化锂、硫酸钾、25%氢溴酸、氯化钾、93%硫酸的销售)、机械设备制造和销售，生物技术、农药技术、化学品技术开发、技术咨询、技术服务、仪器仪表、化工产品(不含危险化学品和易制毒化学品)、矿产品(除专控)、石油制品(不含成品油及危险化学品)、电子产品原料及产品的销售，从事进出口业务。,0
123,002289.SZ,生产、销售液晶显示器(不含国家限制项目，生产场地另设)；销售电子仪器仪表、电子元器件、电脑、通信产品(不含专营、专控、专卖商品)；进出口业务(凭资格证书经营)，机械设备租赁(不配备操作人员的机械设备租赁，不包括金融租赁活动)；自有物业租赁。,3
129,002280.SZ,通讯技术推广、技术开发、技术服务、技术咨询、技术转让；计算机技术培训；批发电子产品、计算机、软件及辅助设备、通讯设备；货物进出口、技术进出口、代理进出口；文化艺术交流活动策划（除演出及演出中介）；设计、制作、发布及代理国内外广告；通信及智能硬件产品设计、开发、销售，物业管理，自有房屋租赁，有色金属、煤炭（无储存）、钢材、办公设备、家用电器及零配件、 日用百货、体育用品、服装鞋帽、化妆品、针纺织品、箱包、钟表、母婴用品、玩具的销售，食品经营（凭许可证经营）、增值电信业务（凭许可证经营）。依法须经批准的项目，经相关部门批准后方可开展经营活动。）,1
132,300509.SZ,液体包装机械、水处理设备制造、销售；自营和代理各类商品和技术的进出口业务（国家限定企业经营或禁止进出口的商品及技术除外）。（依法须批准的项目，经相关部门批准后方可开展经营活动）,2
133,300487.SZ,吸附及离子交换树脂、新能源及稀有金属提取分离材料、固相合成树脂、层析树脂、核级树脂和生物医药酶载体的研发、生产和销售；吸附、交换分离系统装置的研发、制造和销售；管道工程施工；机械设备（不含特种机械设备）、化工设备和机电设备的安装及系统集成；吸附分离应用技术的研发、技术咨询和服务；房屋租赁；物业管理；货物和技术的进出口经营（国家限制和禁止进出口货物和技术除外）。 （依法须经批准的项目，经相关部门批准后方可开展经营活动）,0
135,300684.SZ,经营本企业和成员企业自产产品及技术出口业务；本企业和成员企业生产所需的原辅材料、仪器仪表、机械设备、零配件及技术的进口业务(国家限定公司经营和国家禁止进出口的商品除外)；经营进料加工和“三来一补”业务。(企业依法自主选择经营项目，开展经营活动；依法须经批准的项目，经相关部门批准后依批准的内容开展经营活动；不得从事本市产业政策禁止和限制类项目的经营活动。),0
136,002683.SZ,矿山工程施工总承包、爆破与拆除工程、土石方工程、地基与基础工程、隧道工程专业承包；民用爆破器材生产及销售本企业生产的民用爆炸物品；承包境外爆破与拆除、土石方工程和境内国际招标工程，上述境外工程所需的设备、材料出口；爆破作业项目的设计施工、安全评估以及安全监理；上述相关的技术研发与咨询服务，爆破清渣，机械设备租赁；基础工程、航道工程、民爆器材生产经营；工程技术研发与咨询服务；军工产品科研、生产与销售；产业投资、资产管理与基金管理；技术开发；企业管理与咨询、资产租赁服务。（以上各项具体按本公司有效证书经营）公司的经营范围以工商行政管理部门最终核定的为准。,0
137,002987.SZ,技术开发、技术推广、技术转让、技术咨询、技术服务；计算机技术培训；计算机系统服务；数据处理；计算机维修；基础软件服务、应用软件服务；销售开发后产品、计算机、软件及辅助设备、机械设备、电子产品；接受金融机构委托从事金融信息技术外包服务、接受金融机构委托从事金融业务流程外包服务、接受金融机构委托从事金融知识流程外包服务、接受金融机构委托从事银行网点引导员、银行后台集中作业业务记账处理、银行专业设备技术研发、银行现金清分整点管理、自助银行设备运营管理维护、数据处理、档案数字化加工及保管、金融业务咨询、柜员业务、劳务服务的外包服务；货物进出口、技术进出口、代理进出口；人才中介服务；劳务派遣（劳务派遣经营许可证有效期至2023年 05 月 25 日）；第二类增值电信业务中的呼叫中心业务（增值电信业务经营许可证有效期至 2023 年 05 月 18 日）。（ 市场主体依法自主选择经营项目，开展经营活动；人才中介服务以及依法须经批准的项目，经相关部门批准后依批准的内容开展经营活动；不得从事国家和本市产业政策禁止和限制类项目的经营活动。 ）,1
