442,300502.SZ,研究、开发、生产、销售计算机网络设备及零部件、通讯设备（不含无线电发射设备）及零部件并提供技术服务；自营商品进出口、技术进出口等（以上范围不含国家法律法规限制或禁止的项目，涉及许可的凭相关许可证开展经营活动）。,4
444,300433.SZ,研发、生产与销售光学镜片，玻璃制品，金属配件，TFT-LCD、PDP、OLED、FED平板显示屏、3D显示屏及显示屏材料，触控开关面板及模组；机械设备租赁；卫生材料及医药用品制造。(依法须经批准的项目，经相关部门批准后方可开展经营活动),3
456,300145.SZ,水泵、电机、金属冲压件、紧固件、不锈钢精密铸件、供水设备、配电柜的制造、安装及售后服务，木板加工，金属切削加工，收购本企业生产所需的原辅材料，经营进出口业务，污泥处理处置系统、污水处理、饮用水处理、工业废水处理、中水回用处理系统的设计、安装、调试及技术服务，环境技术咨询服务。(依法须经批准的项目，经相关部门批准后方可开展经营活动),2
458,002947.SZ,电子材料及器件、绝缘材料及器件、光学材料及器件、纳米材料及器件、精密结构件、纸制品的研发、设计、加工、生产、销售；货物及技术的进出口业务；包装装潢印刷品印刷(按《印刷许可证》核定范围核定类别经营)(前述经营项目中法律、行政法规规定前置许可经营、限制经营、禁止经营的除外)(依法须经批准的项目，经相关部门批准后方可开展经营活动)。,3
465,002827.SZ,民用爆炸物品生产（许可证有效期至 2022年 11月18 日）、民用爆炸物品销售（ 许可证有效期至2022年 5月 12日）；仓储服务；包装物的销售。（依法须经批准的项目，经相关部门批准后方可开展经营活动）。,0
467,300139.SZ,技术开发、技术推广、技术转让、技术咨询、技术服务、电子技术培训；承接网络系统集成，货物进出口、技术进出口、代理进出口；安装输配电及控制设备、电子设备用机电元件、继电器、继电保护及自动化装置、电力电子装置；设计电力半导体器件、电力集成电路、半导体集成电路、膜集成电路、集成电路芯片、微型组件、集成电路及微型组件的零件；计算机服务；应用软件服务；物联网传感器及通讯设备、智能电网系统集成，低压集抄系统设备的生产和制造；自有商业房屋租赁服务，办公房屋租赁服务。,3
468,002897.SZ,接插件、接插件端子、模具的研发、生产和销售； 货物进出口、技术进出口；电镀加工（ 另设分支机构：乐清市环保产业园区 C1 地块；乐清市翁垟街道创新创业园区 A 地块）。（依法须经批准的项目，经相关部门批准后方可开展经营活动）,3
469,300386.SZ,技术开发；技术转让；技术服务；研发、 生产、 销售智能卡、磁条卡、刮刮卡、电子标签及电子设备、 信息安全设备、 通信终端设备、税控电子设备、智能终端设备、发卡机终端及其辅助设备；系统软件开发；技术进出口；货物进出口；代理进出口；销售计算机软硬件及辅助设备；设计、制作、代理、发布广告；营销策划；组装IC卡读写机；开发、生产经国家密码管理机构批准的商用密码产品； 销售经国家密码管理局审批并通过指定检测机构产品质量检测的商用密码产品；经营电信业务。,1
471,300757.SZ,研发、组装生产、销售：新能源设备、LED及半导体领域相关生产设备、制程设备及相关配套自动化设备，汽车精密零部件领域智能自动化设备；承接自动化专用设备及智能装备的定制及销售；自产产品相关零部件的生产及销售；信息技术与软件系统设计、开发、技术咨询、服务、转让；从事自产产品的进出口业务，并提供相关技术咨询、开发等服务。(依法须经批准的项目，经相关部门批准后方可开展经营活动),2
482,300330.SZ,设计、开发、生产和销售智能卡读写设备及系统，自动售检票设备及系统，电子收款机及系统，相关智能仪器仪表及设备并提供安装服务； 从事自行车租赁系统、 智能卡 POS 机及相应的充值机、结算机系统、计算机、电子工程领域内的技术开发、技术转让、技术咨询、技术服务，建筑智能化设计和施工， 电子工程，雷达、导航与测控系统工程，计算机及应用和信息网络工程，通信和综合信息网络工程，监控系统工程，电子自动化工程，电子声像工程，电磁兼容工程，电子机房工程，电子设备安装工程， 安全技术防范产品及工程， 机电设备安装，自有房屋租赁。【依法须经批准的项目，经相关部门批准后方可开展经营活动】,1
487,002106.SZ,生产和经营彩色滤光片、触摸屏、镀膜导电玻璃及真空镀膜产品，开发相关技术设备并提供相应的技术咨询服务。液晶显示器件及电子产品的技术开发和销售；普通货运；经营进出口业务；投资兴办实业。,3
490,300245.SZ,计算机软硬件开发、销售、维修，系统集成，通讯设备的销售及维修，提供相关的技术咨询、服务，自有设备租赁，从事货物及技术进出口业务。(涉及行政许可的，凭许可证经营)。,1
493,300078.SZ,塑胶产品、电子产品、五金产品的制造(凭许可证经营)、开发及销售。物联网技术开发、技术应用推广服务，信息系统集成，货物进出口，商业、饮食、服务专用设备、社会公共安全设备及器材的制造。服务：房屋设备租赁，医疗技术，织物洗涤，医疗用品的消毒、灭菌(限分支机构经营)；销售：纺织品、医疗器械、日用百货、消毒用品(不含药品)。(依法须经批准的项目，经相关部门批准后方可开展经营活动),3
494,300083.SZ,研发、设计、生产、加工、销售：通信产品、电脑产品、消费电子产品的塑胶类精密模具及精密零组件，镁合金、铝合金等金属类精密模具及精密零组件，金属粉末冶金注射成型（ MIM）类精密模具及精密零组件，碳纤维等其他复合材料类精密模具及精密零组件。移动终端及其他产品的各类天线产品的设计、技术开发、生产和销售；各类传感器等电子元器件产品的设计、开发、生产和销售；生物工程材料、其他新型材料及其产品的研发、设计、生产、加工、销售。触摸屏及其保护玻璃、 LED 等光学、光电类产品及其精密零组件的研发、设计、生产、加工、销售。智能制造系统的研发；自动化、智能化设备及配件的咨询、设计、制造、改造、销售、安装及技术服务；数字化车间、智能化工厂自动化生产线的咨询、设计、制造、改造、销售、安装及技术服务；从事机械技术领域内的技术开发、技术咨询、技术服务；智能制造教育类产品的设计和技术服务；汽车零部件、机械设备及配件、电子产品、通信设备及相关产品、计算机软件及辅助设备、工业自动化控制设备销售；快速成型的技术开发与技术服务；物联网技术服务；传感器开发与销售；工业软件的开发、技术服务；大数据分析、技术服务。计算机软件的技术开发及销售；机械设备的销售、 租赁；机器人与自动化设备、机械电子设备、工业机器人及数控机床的设计、开发、服务、租赁；光电技术及产品开发、销售、租赁；五金制品、机械零部件、机电设备的技术开发、销售、租赁； 口罩机的研发、生产、销售、调试安装及售后服务；第二类医疗器械（医用口罩）、日用口罩（非医用）的生产、销售； 房产、设备等的经营性租赁； 经营性租赁相关的服务业务；国内贸易，货物及技术进出口。,3
495,300062.SZ,输配电及控制设备、电线电缆及电工器材的研发、生产加工、批发、零售、技术咨询、技术维护及设备安装；国内一般贸易、货物及技术的进出口贸易（不含进口分销）；软件开发与信息系统集成服务；能源微电网的建设、经营；机械设备租赁；电力工程和新能源领域的工程技术、技术开发、技术转让、技术咨询、技术服务；太阳能、风能、生物质能电站的建设、经营。（依法须经批准的项目，经相关部门批准后方可开展经营活动）,5
496,300101.SZ,设计、开发、销售集成电路、微波组件及相关电子器件； 设计、开发、生产(另设分支机构或另择经营场地经营)、销售卫星导航应用设备、软件和相关电子应用产品;设计、开发、生产(另设分支机构或另择经营场地经营)、销售监控电视摄像机； 软件开发、信息系统集成、工程设计、施工和相关技术服务、技术转让及信息咨询;数据处理、存储服务； 货物进出口、技术进出口;电子与智能化工程设计、施工(凭资质证书从事经营)； 电信业务代理(凭电信业务代理合同在合同期内经营);(依法须经批准的项目， 经相关部门批准后方可开展经营活动)。,4
497,300215.SZ,开展各类发电设备、输变电设备、机电设备、高低压电器元件、高低压成套配电装置、日用电器元件、机床电器、船用电器、核用电器、矿用电器、避雷器、 电容器、变压器、互感器、绝缘子、电抗器、高原电器、汽车电子电气、机车车辆电器、航空电器、电力金具、电器节能产品、电磁兼容、化学物质、环境、可靠性、低碳、抗震、防爆、太阳能光伏、风电设备、电源设备、电机、电缆、自动化元件及控制系统、电器测试仪器的检测和校准、检测技术方面的技术开发、技术转让、技术咨询和技术培训、技术服务、检测服务；电器产品型式试验及抽样试验；检验设备监理、检验工程安装及维修；道路普通货物运输。,5
498,002512.SZ,研发、生产、销售：非接触 IC 智能卡、非接触式 IC 卡读卡器；接触式智能卡、接触式 IC 卡读卡器；电子标签；信息系统集成工程及技术服务；电子通讯设备、计算机周边设备；电子遥控启动设备；家用小电器；包装装璜印刷品、其他印刷品印刷；货物进出口、技术进出口（法律、行政法规禁止经营的项目除外；法律、行政法规限制经营的项目须取得许可后方可）。（依法须经批准的项目，经相关部门批准后方可开展经营活动）,3
500,300125.SZ,从事信息科技、健康科技、智能科技、计算机软硬件、新能源科技领域内的生产、销售、技术开发、技术转让、技术咨询、技术服务；实业投资、医疗器械经营、自有房屋租赁、自有设备租赁；从事货物及技术的进出口业务；企业管理咨询；健康管理咨询（不得涉及医疗行为）；软件开发、广告设计、制作、代理、发布。（除依法须经批准的项目外，凭营业执照依法自主开展经营活动）,5
501,300120.SZ,生产经营触摸屏、背光源、集成电路引线框架、液晶显示器及电路配件，小型家用电路产品（不含许可证管理国家限制产品）；集成电路块的组装；生产经营电话机及相关配件、手机零配件、相关电子产品；生产、加工、销售电线、电缆、有色金属材料、绝缘材料、矽钢片、电抗器***,3
503,002518.SZ,软件开发、销售及相关技术服务(不含限制项目)；电力工程施工总承包；机电工程施工总承包；电力设施的安装、维修和试验；光伏电站的投资、开发、建设和运营；数据中心的投资、开发、建设和运营；计算机信息系统集成；空调制冷设备的安装、维修和保养；自有物业租赁；设备租赁(不含融资租赁)；蓄电池销售(不含限制项目)；国内商业、物资供销业(不含专营、专控、专卖商品)；经营进出口业务(法律、行政法规、国务院决定禁止的项目除外，限制的项目须取得许可后方可经营)。,5
504,002475.SZ,生产经营连接线、连接器、电脑周边设备、塑胶五金制品。,3
506,002388.SZ,电子工具、仪器仪表设备、电子元器件、化工产品的销售及售后服务；其他国内商业、物资供销业(不含专营、专控、专卖商品)；信息咨询(不含限制项目)；从事货物、技术进出口业务(不含分销、国家专营专控商品)；普通货运；净化产品的开发及销售；净化工程的设计与安装、机器设备租赁；五金零配件的销售；房屋租赁及管理。金属防腐蚀的研发、生产、销售。,3
508,002413.SZ,制造卫星导航定位接收机、雷达及配套设备、工业控制计算机、频谱测量仪器、干扰场强测量仪器；加工计算机软硬件；计算机系统服务；投资管理；资产管理；企业管理；技术开发、技术推广、技术转让、技术咨询、技术服务，自营和代理各类商品及技术的进出口业务，但国家限定或禁止进出口的商品及技术除外。(依法须批准的项目，经有关部门批准后方可开展经营活动),4
512,300128.SZ,一般经营项目：智能交互感知技术、物联网技术、互联网分布式云技术、高速通讯传输系统技术、光感控技术、新型电子墨水显示技术、纳米新材料技术、新型节能技术的研发、技术咨询、技术服务、技术转让；销售：新型电子墨水显示产品、石墨烯、光伏产品、银浆、蓝宝石衬底图案化产品；企业管理服务及咨询；自有不动产租赁；加工各种高性能复合材料、高分子材料，提供自产产品的售后服务；手机软件、计算机软件(含游戏)开发；从事上述商品和技术的进出口业务。,3
514,300132.SZ,"药用辅料[樟脑(合成)]、原料药[樟脑(合成)]、中药饮片（冰片）的生产；2-莰醇（冰片）、莰烯、双戊烯的生产； 1,2-二甲苯、 1,3-二甲苯、 1,4-二甲苯、氢氧化钠溶液[含量≥30%]、松节油、 乙酸[含量＞80%]、 溶剂油[闭杯闪点≤60℃]、 莰烯、 α -蒎烯、 β -蒎烯、 2-莰醇、 双戊烯、三乙胺、氯化苄、 正磷酸、硼酸、三氟化硼、三氟化硼乙酸络合物、 甲基异丙基苯、甲醇（剧毒品除外）的批发；化工产品（不含危险化学品及易制毒化产品）、香料及香料油的生产；医药工程的设计与施工； 机械设备、仪器仪表及零配件销售；非织造布、 化妆品的制造及销售； 对外贸易。（依法须经批准的项目，经相关部门批准后方可开展经营活动）",0
517,002491.SZ,互联网网页设计；计算机网络集成技术服务；无线通信设备、传输设备、数据通信设备、宽带多媒体设备、物联网及通信相关领域产品的研发、生产、销售、技术服务；市话电缆、特种电缆、光缆、双芯铁芯电话线、双芯铜包钢电话线、电线电缆、光纤、通信电缆、RF电缆、漏泄同轴电缆、室内光缆生产、销售及相关检测技术服务；光电缆原材料销售；废旧金属回收；道路普通货物运输；自营和代理各类商品及技术的进出口业务。(国家限定企业经营或禁止进出口的商品和技术除外)(依法须经批准的项目，经相关部门批准后方可开展经营活动)。,4
518,300846.SZ,技术开发、技术推广、技术服务、技术咨询；计算机系统服务；数据处理；基础软件服务；应用软件服务；销售计算机、软件及辅助设备、电子产品；出租商业用房；机械设备、电子产品租赁；技术进出口、货物进出口、代理进出口；经营电信业务。(企业依法自主选择经营项目，开展经营活动；经营电信业务以及依法须经批准的项目，经相关部门批准后依批准的内容开展经营活动；不得从事本市产业政策禁止和限制类项目的经营活动。),1
519,300634.SZ,一般经营项目： 计算机软、硬件通信设备的技术开发、计算机系统集成及相关技术服务、信息技术咨询；软件销售（以上均不含限制项目）；信息服务业务（仅限互联网信息服务和移动网信息服务业务）；经营第二类增值电信业务中的国内呼叫中心业务、信息服务业务（不含固定网电话信息服务和互联网信息服务）；设计、制作、代理、发布各类广告；自有物业租赁；物业管理；计算机软件及技术服务外包； IT 系统及通信设备运维； 为科技企业提供共享设施、技术服务、创业辅导服务； 商务信息咨询（不含限制项目），企业管理咨询（不含限制项目），企业形象设计，会展会务服务；市场营销策划，图文设计制作，市场调研与研究（不含限制项目），信息监测及数据处理；通信业务代理。（以上法律、行政法规、国务院决定禁止的项目除外，限制的项目须取得许可后方可经营）， 许可经营项目： 电信业务经营； 售电业务（电力销售服务、电力购售电贸易、新能源贸易、电力电商、电力客户专业服务）；配电网投资与运营；电力项目投资；电力工程设计安装；节能技术服务；承装（修、试、维护）电力设施；电力数据处理和分析服务；能源管理及技术咨询服务；新能源技术开发与技术服务、充电设备销售、建设运营；建筑智能化工程设计与施工； 停车场服务； 经营性互联网文化活动、网络音乐。,1
521,300469.SZ,计算机软硬件、系统集成、网络工程、电子信息领域内的“四技”服务，计算机软硬件，网络工程设备，公共安全防范工程设计及施工，建筑智能化工程设计与施工，计算机数据处理。【依法须经批准的项目，经相关部门批准后方可开展经营活动】,1
524,002335.SZ,"变压器、整流器和电感器制造;配电开关控制设备制造;光伏设备及元器件制造;其他未列明电气机械及器材制造;通信系统设备制造;其他未列明制造业(不含须经许可审批的项目);风力发电;太阳能发电;其他未列明电力生产;电力供应;计算机、软件及辅助设备批发;其他机械设备及电子产品批发;经营各类商品和技术的进出口(不另附进出口商品目录),但国家限定公司经营或禁止进出口的商品及技术除外;其他未列明批发业(不含需经许可审批的经营项目);软件开发;信息系统集成服务;信息技术咨询服务;数据处理和存储服务;其他未列明信息技术服务业(不含需经许可审批的项目);自有房地产经营活动;其他未列明的机械与设备租赁(不含需经许可审批的项目);对第一产业、第二产业、第三产业的投资(法律、法规另有规定除外);投资管理(法律、法规另有规定除外);其他未列明服务业(不含需经许可审批的项目);合同能源管理;资产管理(法律、法规另有规定除外);动力电池制造;其他未列明电池制造;电气安装;其他未列明建筑安装业;城市及道路照明工程;蓄电池及储能设备;空调设备的研发、生产、销售;节能设备及工程;太阳能或风光互补路灯系统;LED 路灯;电力工程;机电设备安装工程;安全技术防范系统和机房工程的设计;施工安装及相关咨询服务;轨道交通设备及系统集成;新能源汽车充电及装备系统销售;数据中心运维服务;建设工程勘察设计;电动汽车充电设施建设运营;电动汽车充电设备及装备系统研发、生产、销售服务和咨询；社会公共安全设备及器材制造、锂离子电池制造、管道和设备安装、金属结构制造、工程和技术研究和试验发展、承装、承修、承试电力设施、其他电子设备制造、节能技术推广服务。",5
525,300107.SZ,"生产销售间氨基苯酚、氯乙烷、 溴丁烷、间苯三酚（ 在安全生产许可证有效期内经营）； 生产销售间氨基苯磺酸、间羟基-N.N-二乙基苯胺、苯胺—2.5—双磺酸单钠盐、 2-苯氨基-3-甲基-6-二乙基荧烷（ ODB-1）， 2-苯氨基-3-甲基-6-二丁基荧烷(ODB-2)、 4,4'-二氯二苯砜、 4,4'-二氨基二苯砜、 3,3'-二氨基二苯砜、环氧树脂及其固化剂、有机中间体（危险化学品除外）。经营本企业自产产品及技术的出口业务和本企业所需的机械设备、零配件、原辅材料及技术的进口业务（ 依法须经批准的项目，经相关部门批准后方可开展经营活动）。",0
526,300141.SZ,高低压电器及成套设备（含断路器）、 变压器、 配用电终端及其成套设备、箱式变电站、柱上断路器、柱上负荷开关、 电工器材、电力滤波装置、无功补偿装置、电力储能装置、 储能设备、光伏系统及设备、 电动汽车充电设备、新能源汽车充换电站（点）建设与运营、能源管理及其它电力电子类环保节电装置的研发、制造、销售；并提供相关产品的方案设计、安装、调试及其它售后服务；自有房屋出租；设备出租。（依法须经批准的项目，经相关部门批准后方可开展经营活动。）,5
528,002369.SZ,一般经营项目：计算机周边板卡、消费数码产品、通讯网络产品、音响产品、广播电影电视器材、调制解调器(不含卫星电视广播地面接收设施)、U盘、MP3、MP4、数字电视系统用户终端接收机、网络交换机、无线网络适配器、无线路由器、VOIP网关、VOIP电话、IP机顶盒的组装生产(在许可有效期内生产)；手机和平板电脑等移动手持终端的生产(由分支机构经营，执照另行申办)；技术开发、购销、电子产品的购销及其他国内商业、物资供销业(不含专营、专控、专卖商品)；经营进出口业务(法律、行政法规、国务院决定禁止的项目除外，限制的项目须取得许可后方可经营)；机械设备租赁(不配备操作人员的机械设备租赁，不包括金融租赁活动)；汽车租赁(不包括带操作人员的汽车出租)；计算机与通讯设备租赁。许可经营项目：无。,4
530,300253.SZ,从事健康科技领域内的技术开发、技术转让、技术咨询、技术服务， 医疗器械生产（ II 类 6870 影像档案传输、处理系统软件）， 医疗器械经营， 实业投资， 自有房屋租赁；计算机软件的开发、设计和制作，计算机软、硬件及辅助设备的销售，计算机网络信息系统集成的维护，并提供相关的技术咨询和技术服务。【依法须经批准的项目，经相关部门批准后方可开展经营活动】,1
532,300624.SZ,"电子计算机软件、网络、硬件及外部设备的技术开发、技术咨询(不含限制项目);电子计算机软件、硬件、外部设备及计算机耗材的代理、销售(不含专营、专控、专卖商品);家庭智能集成设备、移动智能设备的技术开发、技术咨询、技术服务;家庭职能集成设备、移动智能设备及耗材的销售(生产项目另行申办营业执照),经营进出口业务;信息服务业务；【依法须经批准的项目，经相关部门批准后方可开展经营活动】。",1
534,300041.SZ,"胶粘剂、汽车制动液、原子灰、液压油、润滑油、润滑脂的生产与销售；润滑剂、制冷剂等专项化学制品及相关使用设备、精细化工产品的研究与开发及销售（不含危险化学品和国家禁止经营的化学品）； 丙烯酸酯聚合物类胶粘剂、氯丁胶粘剂、气溶胶（清洗剂、松动剂）、聚氨酯类胶粘剂、橡胶涂料和涂胶用稀释剂等的销售（有效期至 2023 年 2 月 18 日）； 商品及技术进出口业务（不含国家限制或禁止的商品和技术进出口）。（涉及许可经营项目,应取得相关部门许可后方可经营）",0
540,300121.SZ,安全生产许可证许可范围内的危险化学品生产（有效期限以许可证为准）。货物及技术进出口业务；橡胶防焦剂 CTP、橡胶助剂的制造，化工产品（不含危险品）销售（ 依法须经批准的项目，经相关部门批准后方可开展经营活动）。,0
542,002456.SZ,开发、生产经营光电器件，光学零件及系统设备，光网络、光通讯零部件及系统设备，电子专用设备仪器，并提供相关的系统集成、技术开发和技术咨询服务，新型电子元器件、光电子元器件、新型显示器件及其关键件的研发、生产、销售和技术服务。,3
