1227,000818.SZ,氢氧化钠；氯[液化的]；盐酸；氯苯；二氯苯；氢气； 1， 2—环氧丙烷；聚醚（中间产品环氧丙烷）；丙二醇（中间产品环氧丙烷）； 1， 2—二氯丙烷；次氯酸钠溶液[含有效氯＞5%]；硫酸（稀）；氧气（压缩的）；氮气（压缩的）生产、加工、销售；三氯乙烯；二氯乙烷；聚氯乙烯（中间产品氯乙烯）；副产盐酸；硫酸钠（芒硝）；乙炔（溶于介质的）的生产；化工石油工程施工总承包二级，房屋建筑工程施工总承包三级；压力容器制造D1、 D2 级，压力管道安装 GB2、 GC2 级，机械加工、安装、铸钢铸铁、化工防腐蚀工程；在港区内提供货物仓储（仅限锦州分公司经营） ；吊装，劳务；第一、二类、三类在用压力容器检验；分装、中转、贮运石油化工产品（凭许可证经营）；塑料制品加工及组装，塑钢门窗及安装，不干胶印刷，其它印刷品印刷；过氧化二--（ 2-乙基己基）二碳酸酯；复合热稳定剂；丙酮缩胺基硫脲；焦磷酸二氢二钠； a—纤维素；普通设备清洗（凭许可证经营）；技术开发与服务，经营本企业自产产品及相关技术的出口业务，经营本企业生产科研所需的原辅材料、机械设备、仪器仪表及相关技术进口业务（国家规定公司经营和国家禁止进出口的商品及技术除外），经营进料加工和“三来一补”业务；发电(自发自用)；工业蒸汽、交直流电、工业清水及民用饮用水、采暖热源的供应及经营；电动机变压器等电器设备维修；公路普通货物运输；锅炉检修；厂内铁路专线运输；电器仪表维修；自有资产出租（含房屋、设备等）；金属包装容器制造、食品添加剂氢氧化钠；盐酸（食品添加剂） ； 消泡剂（聚醚型） ； 聚醚消泡剂（食品添加剂） ；国内水路运输船舶代理、货物代理。（在法律、法规允许的范围内经营，涉及前置许可的凭许可经营）。（具体以工商行政管理机关核准的经营范围为准）,0
1238,000822.SZ,(以下经营项目仅限分支机构凭许可证生产销售)纯碱、工业溴及溴素、工业盐、氯化钙、白炭黑、水玻璃系列产品、硫酸钾、氯化镁系列产品、饲料添加剂的生产、销售；卤水开采、销售(有效期限以许可证为准)；盐膜经销；钙液、冷凝水、回水的销售；国家允许的货物及技术进出口贸易。(依法须经批准的项目，经相关部门批准后方可开展经营活动),0
1239,000823.SZ,制造、加工、销售超声电子仪器、仪器仪表、电子元器件、电子材料、家用电器、通讯产品(不含通信终端)、电子计算机，超声电子仪器的技术服务。经营本企业及属下控股企业自产产品的出口业务、生产所需机械设备、零配件及原辅材料的进口业务，未经外经贸部批准，不得经营国家组织统一联合经营的出口商品的出口业务及国家实行核定公司经营的进口商品的进口业务(按[2000]汕贸管登证字第006号文经营)。,3
1244,000938.SZ,技术开发、技术推广、技术转让、技术咨询、技术服务；委托加工及销售计算机、软件及辅助设备、电子器件、通信设备和广播电视设备（不含无线电发射设备）、玩具、仪器仪表、 文化用品、办公用机械产品；计算机系统服务、计算机维修、数据处理、 软件服务；企业管理、投资管理、 资产管理；房地产开发、商品房销售； 出租办公用房、出租商业用房、出租商业设施；物业服务；经济信息咨询；广告设计、制作、代理、发布；测绘服务；电脑动画设计；会议及展览服务；职业培训、外语培训、电脑培训；从事文化经纪业务；货物进出口、技术进出口、代理进出口。,1
1255,000948.SZ,开发、生产、销售计算机软件、硬件，外围设备、金融专用设备、智能机电产品（含国产汽车不含小轿车），系统集成、网络设备、信息产品；承接网络工程、信息系统工程（不含管理项目）、技术服务及技术咨询；自产产品的安装、调试、维修；进出口业务；房屋租赁业务和培训业务；物业管理；开发、生产经国家密码管理机构批准的商用密码产品，销售经国家密码管理局审批并通过指定检测机构产品质量检测的商用密码产品；电信增值业务；通讯设备销售；计算机及通讯设备经营租赁（依法须经批准的项目，经相关部门批准后方可开展经营活动）,1
1260,300638.SZ,经依法登记，公司的经营范围为： M2M 网关等各类物联网网关、移动通信终端产品的生产及配套软件产品的技术开发和销售；电子产品的技术开发、咨询及购销；股权投资；国内贸易；经营进出口业务； 电信业务经营（许可经营项目） （以上法律、行政法规、国务院决定禁止的项目除外，限制的项目须取得许可后方可经营）。,4
1263,000727.SZ,电子产品、平板显示器件及模块、石英晶体产品、电子线路产品、真空电子、照明器材及材料的生产、加工、销售技术服务；动力设备、照明设备安装、维修；物业管理；金属及建筑材料贸易；自营和代理各类商品及技术的进出口业务(国家限定企业经营或禁止出口的商品和技术除外)。,3
1267,000836.SZ,光纤预制棒、光纤、光缆研发、生产、销售；新材料技术研发、技术服务； 石英材料、石英制品、光学薄膜、陶瓷、石墨制品研发、销售；计算机系统集成；计算机数据处理；仪器仪表、计算机软硬件、电子产品销售；安防工程设计、 施工；自有房屋出租；物业服务；停车服务；货物及技术进出口（法律法规禁止经营的项目除外，法律法规限制经营的项目取得许可后方可经营）。（ 依法须经批准的项目，经相关部门批准后方可开展经营活动）,4
1277,000733.SZ,主营电子信息产品、光机电一体化产品；兼营金融、贸易、房地产开发、经济技术服务等第三产业。,3
1281,000851.SZ,法律、法规、国务院决定规定禁止的不得经营；法律、法规、国务院决定规定应当许可(审批)的，经审批机关批准后凭许可(审批)文件经营；法律、法规、国务院决定规定无需许可(审批)的，市场主体自主选择经营。(多业务宽带电信网络产品、通信器材、通信终端设备、仪器仪表、电子计算机软硬件及外部设备、系统集成的技术开发、转让、咨询、服务及制造、销售；通信及信息系统工程设计；信息服务；自营和代理各类商品和技术的进出口，但国家限定公司经营或者禁止进出口的商品和技术除外。),1
1314,000970.SZ,钕铁硼永磁材料及其他新型材料、各种稀土永磁应用产品的研究开发、生产以及有关技术咨询、服务，工业自动化系统，计算机软硬件产品的技术开发、生产，销售自产产品；道路货物运输。,3
1318,300617.SZ,中低压、高压及超高压电缆附件、电力器材、电缆分支箱和户内外环网开关柜及相关智能化产品的研究、开发、生产、销售、运维及相关的技术咨询；中低压、高压、超高、特高压电器设备及其配件、部件设计、研发、制造、测试、销售及系统整体方案实施和技术服务；金属气体绝缘母线（ GIL）及其配件生产、销售、技术服务；电力工程总承包，输变电工程专业承包，电力设施承装（修、试）（凭许可资质经营）；自营和代理各类商品及技术的进出口业务，国家限定公司经营或禁止进出口的商品和技术除外。（依法须经批准的项目，经相关部门批准后方可开展经营活动）,5
1319,300674.SZ,研究、开发计算机软件、硬件及互联网技术；提供技术咨询、技术服务、技术转让、计算机技术培训；销售自行开发的产品；技术进出口。（依法须经批准的项目，经相关部门批准后依批准的内容开展经营活动。）,1
1323,300747.SZ,大功率脉冲及连续光纤激光器、大功率半导体激光器、固体激光器、光学及光电子元器件的研究、开发、生产、批发兼零售、维修服务、技术咨询；激光精密加工设备的研发、生产、批发兼零售、维修服务；激光器控制软件设计、开发、批发兼零售、维修服务；单位自有房屋租赁；货物进出口、技术进出口、代理进出口(不含国家禁止或限制进口的货物或技术)。(依法须经审批的项目，经相关部门审批后方可展开经营活动),3
1331,300549.SZ,生产精密模具零件、模具、模具制造设备及其零配件、机械零部件设计、加工与技术咨询；热处理加工；销售自产产品；自有厂房租赁。从事与本企业生产同类产品的商业批发及进出口业务。(以上商品进出口不涉及国营贸易、进出口配额许可证、出口配额招标、出口许可证等专项管理的商品)。,2
1335,300319.SZ,经营进出口业务(按深贸准证字第[2001]0793号核准范围办理)；电子元器件、集成电路、电子产品的研发、设计、生产、销售及技术方案设计、技术转让、技术咨询；普通货运；投资兴办实业；自有物业租赁管理。,3
1339,002006.SZ,一般项目： 专用设备制造（不含许可类专业设备制造）；环境保护专用设备制造；纺织专用设备制造；建筑材料生产专用机械制造；光伏设备及元器件制造；汽车零配件零售；汽车零部件及配件制造；汽车零配件批发；技术服务、技术开发、技术咨询、技术交流、技术转让、技术推广（除依法须经批准的项目外，凭营业执照依法自主开展经营活动）。许可项目：民用航空器（发动机、螺旋桨）生产；特种设备制造；货物进出口（ 依法须经批准的项目，经相关部门批准后方可开展经营活动，具体经营项目以审批结果为准）,2
1341,300833.SZ,电子元件及组件制造；电子、通信与自动控制技术研究、开发；软件开发；照明灯具制造；电光源制造；灯用电器附件及其他照明器具制造；舞台灯光、音响设备安装服务；电子自动化工程安装服务；智能化安装工程服务；楼宇设备自控系统工程服务；机电设备安装服务；电子产品设计服务；电气机械设备销售；灯光设备租赁；货物进出口（专营专控商品除外）；技术进出口；销售本公司生产的产品（国家法律法规禁止经营的项目除外；涉及许可经营的产品需取得许可证后方可经营）。,2
1342,300560.SZ,通信线路和设备的安装（不含卫星电视广播地面接收设施安装）；通信传输设备专业修理；软件开发；管道工程建筑；通信工程施工总承包；市政公用工程、电力工程、机电安装工程、钢结构工程、建筑装修装饰工程、建筑智能化工程、安防工程、港口与海岸工程、海洋石油工程的设计与施工；广播电视传输服务； 建筑工程施工总承包相应资质等级承包工程范围的工程施工；输变电工程专业承包相应资质等级承包工程范围的工程施工；城市及道路照明工程专业承包相应资质等级承包工程范围的工程施工； 信息系统集成服务；通信设备、电子产品的研发、生产、销售；移动网增值电信服务；因特网虚拟专用网服务；互联网管理服务；通信设施管理服务；集群通信服务；载波服务；私人通信业务；网元出租服务；物联网服务；房地产中介服务；电子、通信与自动控制技术研究服务；计算机及通信设备租赁；劳务派遣（不含涉外业务）； 智能无人飞行器制造；导航、测绘、气象及海洋专用仪器制造；通用航空生产服务；地理遥感信息服务；对外贸易、货物或技术进出口（国家禁止或涉及行政审批的货物和技术进出口除外）。（依法须经批准的项目，经相关部门批准后方可开展经营活动）,4
1343,002358.SZ,高低压配电成套装置、高低压电器元器件系列产品开发、生产和销售；变压器及变压器台成套系列产品研发、设计、生产和销售；新能源发电（太阳能、风能等）场站及配套电力设施的研发、设计、生产、建设、施工、安装等；轨道交通及铁路电气化系列产品的研发、设计、生产和销售；岸电设施、充电桩（站）及节能减排设施的研发、设计、生产、销售和运维；智能制造（机器人）的研发、设计、生产、集成和销售及运维；模具及工装夹具的设计、制造和销售；自动化控制设备的研发、设计、制造、加工和销售；从事货物及技术进出口业务（国家法律法规规定应经审批方可经营或禁止进出口的货物和技术除外）；工程技术咨询服务，电力工程总承包，电力工程设计，对外劳务合作； 道路机械清扫保洁、冲刷、喷雾降尘、道路普通货物运输、垃圾分类服务、冬季除雪服务；城市生活垃圾清扫、收集、分类、运输、处理（含餐厨垃圾）；园林绿化工程；移动厕所服务；环卫清洁服务；环卫技术开发、咨询；环卫工程设计；环卫设备（含智能垃圾分类设备）销售、租赁、运营维护及售后服务；环卫基础设施管理；市政工程施工、养护。,5
1351,300205.SZ,计算机软硬件及其外部设备、计算机网络、通信、电子、自动化控制系统、仪器仪表、光机电一体化、电子标签、智能卡、磁条卡、刮刮卡及其相关设备等相关产品的开发、生产、销售、技术服务（不含金融储值类业务，不含法律、行政法规、国务院决定规定应经许可经营的项目）； 系统集成和技术服务； 承接社会公共安全工程；商用密码产品的开发、生产、销售(以上产品凭许可证在核定的范围内从事经营）；防伪票证的开发、生产、销售；集成电路卡及集成电路卡读写机的开发、生产、销售；商品和技术的进出口（国家限定或禁止进出口的商品和技术除外）（以工商行政管理局核定的为准）。,3
1353,002025.SZ,电器、电机、光电子产品、线缆组装件、电子控制组件、遥测遥控设备、伺服控制系统、电源、特种分离机构、惯性/敏感元件、抗辐照器件、专用密封件、网络变压器/滤波器、传感器、自动化设备、仪器仪表等的研制、生产和销售。智能制造系统集成方案设计及实施、软件开发及实施服务。经营本企业自产产品及技术的出口业务；经营本企业所需的原辅材料、仪器仪表、机械设备、零配件及技术的进口业务(国家限定公司经营和国家禁止进出口的商品及技术除外),3
1360,002104.SZ,智能卡、磁条卡、票证、票据、密码信封、智能标签、智能终端、商用密码产品及相关系统软件、读写机具的研发、生产、销售、检测、咨询、技术服务；计算机软硬件、网络设备、办公自动化设备、移动支付、物联网、网络信息安全产品的开发、生产、销售及系统集成和技术服务；半导体模块封装生产、检测及技术咨询；自营和代理各类商品和技术的进出口，道路货物运输。（依法须经批准的项目，经相关部门批准后方可开展经营活动）,3
1361,300602.SZ,研发、生产和销售移动通信、网络通信、路由交换、存储及服务器、电力电子器件等相关共性技术及产品；研发、生产、销售电磁屏蔽材料及其器件、吸波材料及其器件、导热材料及其器件、绝缘材料及其器件、高性能复合材料、电子辅料；研发、生产、销售塑胶产品及组件，金属冲压产品及组件，合金铸造产品及组件；国内商业、物资供销业（不含专营、专控、专卖商品）；进出口业务（按深贸进准字第[2001]1868 号文规定办理）；普通货运（在许可有效期内经营）。,3
1367,002869.SZ,一般经营项目：无线收发设备、智能终端设备、网络与电子通信产品、软件产品、计算机与电子信息的技术开发、设计、生产(生产项目另行申办营业执照，由分公司经营)、销售、安装、技术服务及技术咨询；系统集成；工程施工、承包(涉及资质证的需取得主管部门颁发的资质证书方可经营)；电子商务平台的技术开发，网上贸易、数据处理；经营进出口业务；房屋租赁。(以上项目法律、行政法规、国务院决定禁止的项目除外，限制的项目须取得许可后方可经营)。许可经营项目：无。,4
1381,300349.SZ,智能化信息系统集成服务。电子设备及电子元器件、燃气设备、仪器仪表的制造、销售、安装、维修、技术开发、技术服务、技术咨询及成果转让，软件开发、技术服务、技术咨询及成果转让，企业管理咨询，经营进出口业务。(依法须经批准的项目，经相关部门批准后方可开展经营活动),1
1385,002036.SZ,从事光电子元器件、半导体器件、光学元件、摄像头模组、触摸屏及液晶显示模组、手机及计算机等电子产品的研发、生产、销售；光电显示及控制系统的设计与安装，网络及工业自动化工程安装；自营或代理各类商品和技术的进出口业务；投资管理、资产管理、投资咨询服务（除证券、期货）；房屋租赁、机械设备租赁、物业管理。（不涉及国营贸易管理商品，涉及配额、许可证管理商品的，按国家有关规定理申请）。（依法须经批准的项目，经相关部门批准后方可开展经营活动）,3
1387,300801.SZ,"盐酸、亚磷酸、乙酰氯、甲醇、过氧乙酸、二氯丙醇、醋酸酐***生产销售（有效期限以许可证为准）； N,N-二甲基-1,3-丙二胺、次氯酸钠溶液[含有效氯＞5%]、二硫化二甲基、环己胺、 N,N-二甲基甲酰胺、二氯异氰尿酸、氯化锌、氯化锌溶液、吗啉、硫脲、戊二醛、三氯异氰脲酸、乙醇溶液[按体积含乙醇＞24%]***（无储存）批发（有效期以许可证经营期限为准）。水处理剂及助剂、水质稳定剂、纺织印染助剂、混凝土缓凝剂和减水剂、水处理化学品、造纸化学品、油田化学品、日化产品专用化学品、环境污染处理专用药剂材料、有机化学原料、化学试剂及助剂、消毒剂（以上不含化学危险品）的生产、销售及技术服务、技术咨询；电力、热力生产和供应；经营进出口业务。（依法须经批准的项目，经相关部门批准后方可开展经营活动）",0
1388,300627.SZ,卫星导航定位系统及设备、地理信息系统及设备、灾害监测系统及设备、机械自动控制系统及设备、遥感信息系统及设备、无人机系统及设备、组合导航系统及设备、水文测绘系统及设备、安全防范系统及设备、测绘仪器、光学仪器、仪器仪表、通讯设备的生产、销售，从事上述技术专业领域内的技术开发、技术咨询、技术转让、技术服务，仪器仪表设备维修服务，自有设备租赁，计算机信息系统集成，从事货物和技术的进出口贸易业务。【依法须经批准的项目，经相关部门批准后方可开展经营活动】,4
1392,002028.SZ,电力自动化保护设备，电气设备，电力监测设备，电力自动化实验设备，光电设备，仪器、仪表、软件的研究、开发、生产和销售，电力自动化和电力监测领域的“四技”服务，承包与其实力、规模、业绩相适应的国外工程项目；对外派遣实施上述境外工程所需的劳务人员，实业投资，企业管理服务，自有设备租赁，从事货物和技术的进出口业务(涉及许可经营的凭许可证经营)。,5
1393,300376.SZ,智慧城市、智慧园区和轨道交通工程项目投资、运维与改造； 互联网信息服务（增值电信业务经营）；人工智能、量子通信、 泛在电力物联网、 云计算技术的开发；研发、制造与销售： 无线通信设备、存储设备及系统、 不间断电源、应急电源、通信电源、高压直流电源系统、稳压电源、电力一体化电源系统、工业节能及电能质量控制系统、新能源汽车充电桩及配套设备、数据中心产品与系统(包括列头柜、配电柜、机柜)、 精密空调、光伏组件、光伏逆变器、汇流箱、交直流柜、控制器等装置、嵌入式软件、动力环境监控、阀控式密封铅酸蓄电池、锂电池、复合储能系统、智能环保系统；太阳能发电系统及电站、新能源汽车充电站点、智能微电网、计算机网络系统、数据中心、建筑智能化系统解决方案的设计、集成建设、安装、调试、运营和维护； 数据处理和存储服务；技术咨询与服务；设计、制作、代理、发布国内外各类广告；货物或技术进出口（国家禁止或涉及行政审批的货物和技术进出口除外）；贸易代理；仓储服务（不含危险化学品）；道路普通货运；再生资源回收、加工（不含固体废物、危险废物、报废汽车等需经相关部门批准的项目）； 房屋租赁、物业管理。 （依法须经批准的项目，经相关部门批准后方可开展经营活动。）,5
1394,300711.SZ,通信系统设备制造；通信终端设备制造；电子、通信与自动控制技术研究、开发；通信设备零售；通信线路和设备的安装；通讯设备及配套设备批发；通讯终端设备批发；货物进出口（专营专控商品除外）；技术进出口； 房屋租赁；通信设施安装工程服务。,4
1399,002109.SZ,甲醇、合成氨、硫磺、液氧、液氩、液氮、一甲胺、二甲胺、三甲胺、二甲基甲酰胺、硫酸铵(限子公司经营)；本企业生产、科研所需的关键原材料、技术改造所需的关键设备及零部件的进口(国家限制或禁止的除外)。(上述经营范围凡涉及许可证管理的，凭许可证并在有效期内经营),0
1401,002017.SZ,许可经营项目：第二类增值电信业务中的信息服务业务（不含固定网电话信息服务和互联网信息服务）；包装装潢印刷品、其他印刷品印刷。一般经营项目：通信、银行、公共事业等各领域磁条卡、智能卡（含移动电话 SIM 卡、银行卡）、微电子智能标签产品及相关读写机具、无线收发设备、终端设备的研发、生产、销售；计算机软硬件、网络设备和系统集成相关技术开发、销售及技术服务；物联网相关产品研发、生产、销售及技术服务； 纪念卡册（含贵金属纪念卡册）的设计、生产和销售； 半导体模块封装及技术咨询；自有物业出租、管理；商业零售；经营本企业自产产品及相关技术的进出口业务，进料加工和“三来一补”业务；室内外装潢；信息系统集成服务；工程施工、承包（涉及资质证的需取得主管部门颁发的资质证书方可经营）。,4
1403,002888.SZ,电子、通信与自动控制技术研究、开发；广播电视接收设备及器材制造(不含卫星电视广播地面接收设施)；音响设备制造；影视录放设备制造；家用视听设备零售；家用电器批发(依法须经批准的项目，经相关部门批准后方可开展经营活动),3
1404,002909.SZ,密封用填料及类似品制造；化学试剂和助剂制造（监控化学品、危险化学品除外）；粘合剂制造（监控化学品、危险化学品除外）；轻质建筑材料制造；防水嵌缝密封条（带）制造；硬质橡胶制品制造；建筑陶瓷制品制造；建筑用沥青制品制造；货物进出口（专营专控商品除外）；技术进出口；物业管理；自有房地产经营活动；企业自有资金投资；油墨及类似产品制造（监控化学品、危险化学品除外）；化工产品零售（危险化学品除外）；涂料制造（监控化学品、危险化学品除外）；涂料零售； 化工产品批发（含危险化学品；不含成品油、易制毒化学品）；危险化学品储存；新材料技术转让服务； 新材料技术开发服务； 新材料技术咨询、交流服务；机械设备租赁； 办公设备租赁服务。主营项目类别：化学原料和化学制品制造业。,0
1405,002139.SZ,电子产品、照明电器、各类电子智能控制器、电力自动化系统设备、电机及其智能控制器的研发、销售、生产(由分公司经营)；动力电池、电源产品、电脑产品、集成电路、传感器、软件的技术开发与销售；国内贸易(不含专营、专控、专卖商品)，经营进出口业务(法律、行政法规、国务院决定禁止的项目除外，限制的项目须取得许可后方可经营)。,3
