1793,002241.SZ,开发、制造、销售：声学、光学、无线通信技术及相关产品，机器人与自动化装备，智能机电及信息产品，精密电子产品模具，精密五金件，半导体类、MEMS类产品，消费类电子产品，LED封装及相关应用产品；与以上产品相关的软件的开发、销售；与以上技术、产品相关的服务；货物进出口、技术进出口(不含无线电发射及卫星接收设备，国家法律法规禁止的项目除外)。(依法须经批准的项目，经相关部门批准后方可开展经营活动)。,3
1795,002459.SZ,生产、加工单晶硅棒、单晶硅片；生产太阳能电池、组件；研制、开发太阳能系列产品；销售太阳能电池、组件及相关产品与原材料；太阳能光伏并网发电、电量销售；太阳能光伏电站的开发、建设、运营、管理、维护；货物及技术进出口；从事太阳能电池领域的技术开发、技术转让；厂房租赁；场地租赁；电气设备租赁（涉及行政许可的，凭许可证经营） **（依法须经批准的项目，经相关部门批准后方可开展经营活动）,5
1798,002276.SZ,实业投资；电力电缆、船用电缆、矿用电缆、特种电缆、电力器材设备、钢芯铝绞线、铜铝丝的生产、加工、销售；软件系统的开发、销售；金属材料、化工产品(非危险品)的销售；电力线路设计及工程施工；经营进出口业务。,5
1801,002169.SZ,电气、电子、计算机及自动化产品的开发、加工、安装、设计、技术服务。销售：电气设备、电子产品、电子计算机。货物进出口、技术进出口(法律、行政法规禁止的项目除外；法律、行政法规限制的项目须取得许可后方可经营)。,5
1803,002255.SZ,锅炉(特种锅炉、工业锅炉)、核承压设备、锅炉辅机、压力容器、金属包装容器、机械、冶金设备、金属结构件制造、销售、安装和运输；金属材料购销；金属包装容器、压力容器设计(按特种设备设计许可证核准经营范围经营)；经营本企业自产产品及技术的出口业务；经营本企业生产、科研所需的原辅材料、仪器仪表、机械设备、零配件及技术的进口业务(国家限定公司经营和国家禁止进出口的商品及技术除外)；经营进料加工和“三来一补”业务；实业投资及技术咨询。,2
1810,300001.SZ,研发、设计、制造500kV及以下的变配电一二次产品、新能源汽车充换电设备及相关产品，提供产品相关技术服务、施工服务；电力工程施工；建筑机电安装工程施工；电力设施的运维、检修、试验项目；电力销售；电力设备租赁及相关技术服务；特种车辆的组装、拼装；新能源汽车充换电站(点)建设与运营；新能源汽车销售；汽车销售；能源管理；融资租赁业务；进出口贸易；计算机软件开发、销售、服务、技术咨询；智能电子产品和信息产品嵌入式软件开发、销售、服务。(依法须经批准的项目，经相关部门批准后方可开展经营活动),5
1811,300004.SZ,研究、开发、生产、销售：风机，机电设备，电控设备，通风设备，电机，空调冷柜，风机盘管，泵及真空设备，阀门和旋塞，风电设备，消声器，电加热器；销售：钢材，金属制品（金银除外），建筑材料，电工器材，电讯器材；货物进出口、技术进出口（法律、行政法规禁止的项目除外；法律、行政法规限制的项目须取得许可证后方可经营）。（依法须经批准的项目，经相关部门批准后方可开展经营活动。）,5
1812,002386.SZ,基本化学原料，有机合成化学原料，化工产品制造、销售(含危险化工产品生产及本企业生产的危险化工产品销售，其许可范围及有效期以许可证为准)及进出口贸易，塑料制品，压力容器，电器维修，电线电缆，建材，三级土建工程，化工防腐，化工机械制造安装，电器仪表安装施工(需许可证的限取得许可证的分公司经营)，生产医用氧(有效期以许可证为准)，香精香料的生产、销售(凭许可证经营)，电力业务(按许可证范围经营，有效期至2029年6月16日止)。,0
1814,300213.SZ,生产、制造数字调度设备、专用通信设备；电子产品、通信设备、安防设备、监控设备、电气机械、自动控制设备、仪器仪表、专用设备、办公用机械的技术开发、技术咨询、技术服务；通信及自动化控制、计算机软硬件及网络系统的设计、开发、集成、安装、调试和服务；销售汽车、手机；货物进出口、技术进出口、代理进出口；专业承包；租赁机器设备、租赁办公用房、租赁商业用房等；以下仅限分公司经营：生产手机。(依法须经批准的项目，经相关部门批准后依批准的内容开展经营活动。),4
1815,002164.SZ,减速电机、减速器、风电齿轮箱、车辆齿轮、机车齿轮、电机、电气机械及器材、运输机械、通用设备的制造、加工、技术咨询；实业项目投资及其咨询服务；普通货物的仓储；机械设 备、五金产品批发、零售；普通货运（在许可证件有效期限内运营）。自营和代理各类 货物和技术的进出口，但国家限定公司经营或禁止进出口的商品及技术除外。（依法须经批准的项目，经相关部门批准后方可开展经营活动。）,5
1816,002253.SZ,软件、硬件及配套系统开发，系统集成和图象图形工程，从事安防产品生产、销售及安防工程设计、施工；建筑智能化工程设计、施工；房屋租赁、设备租赁；民航空管工程及机场弱电系统工程施工；电子工程、电子工程施工；电子及通信产品生产、销售；技术咨询、技能培训；经营本企业和本企业成员企业自产产品及相关技术的出口业务（国家限定和禁止经营商品除外），经营本企业和本企业成员企业生产、科研所需的原辅材料、机械设备、仪器仪表、零配件及相关技术的进口业务（国家限定或禁止经营商品除外）；经营本企业的进料加工和“三来一补”业务； 专利和非专利技术许可使用、转让。（依法须经批准的项目，经相关部门批准后方可开展经营活动）。,1
1817,002246.SZ,生产硝化棉、硫酸；销售危险化学品（以上经营项目和期限以许可证为准）；军用防护器材的设计开发、生产、制造、销售、服务（该经营项目和期限以子公司许可证为准，且仅限子公司科研、生产和经营）（以下项目不含前置许可项目，后置许可项目凭许可证或审批文件经营）进出口；机械制造；机械设备制造及修理；黑色金属冶炼及压延加工； 有色金属冶炼及压延加工；金属制品；商品批发与零售；技术推广服务；活性炭制品的设计开发、生产、制造、销售、服务；活性焦、运输带、橡胶制品、工业防毒面具和滤毒罐、消防产品、水净化器材、环保器材、空调及制冷设备、活性炭设备及净化再生装置的研制、生产、安装、销售；承揽工装模具；办公家具的生产和销售；环境工程（除建筑工程）；废弃资源综合利用。（依法须经批准的项目，经相关部门批准后方可开展经营活动）,0
1819,002195.SZ,计算机软、硬件系统及相关系统的集成、开发、咨询、销售及服务，经营本企业自产产品的出口业务和本企业所需的机械设备、零配件、原辅材料的进出口业务（但国家限定公司经营或禁止进出口的商品及技术除外），本企业包括本企业控股的成员企业，信息服务业务（含短信息服务业务，不含互联网信息服务业务，电话信息服务业务）， 实业投资。【依法须经批准的项目，经相关部门批准后方可开展经营活动】,1
1821,002362.SZ,技术开发、技术转让、技术咨询、技术服务、技术培训；电脑图文设计、制作；计算机网络安装、维修；承办展览展示；投资咨询、经济信息咨询；购销计算机软硬件及外部设备、机械电器设备、通讯设备(不含无线电发射设备)、五金交电、化工产品(不含危险化学品级一类易制毒化学品)、橡胶制品、塑料制品、建筑材料、民用建材、金属材料；自营和代理各类商品及技术的进出口，但国家限定公司经营或禁止进出口的商品和技术除外;数据处理。,1
1823,002226.SZ,民用爆破器材【乳化炸药(胶状)、粉状乳化炸药、乳化炸药(胶状，现场混装车)、多孔粒状铵油炸药(现场混装车)等】研发、生产、销售；工程爆破设计、施工、爆破技术服务；爆破合成新材料研发、生产、销售；化工产品及原辅材料(不含危险化学品)生产、销售；危险货物运输；机电设备产品生产、销售(上述项目仅限分支机构经营)；新能源技术，电力技术，生物质发电技术，风力发电技术，光伏发电技术开发、咨询、服务及成果转让；风力发电、光伏发电、光热发电等清洁能源的生产及销售；与公司信息化建设相关的信息业务咨询；与公司生产、服务相关的技术业务咨询；自营本公司产品和技术的进出口业务(国家限定公司经营或禁止进出口的产品和技术除外)；实业投资。(依法须经批准的项目，经相关部门批准后方可开展经营活动)(最终经营范围以所在地工商管理机关核准登记为准),0
1824,002217.SZ,新型平板显示器件、触摸屏、摄像头及其周边衍生产品(含模块、主板、方案、背光、外壳、连接器、充电系统、电声、电池、电子元器件)、智能控制系统产品、智能穿戴设备、家电控制设备及配件、指纹识别模组，盖板玻璃，工业自动化设备及配件等产品的设计、生产、销售、研发和以上相关业务的技术开发、技术咨询、技术服务；纯碱、氯化铵、硫化异丁烯、硝酸异辛酯、三聚氰胺、氨水(≤10%)、尿素、复肥、尿素—硝酸铵水溶肥的生产销售；货物及技术进出口业务；农用碳酸氢铵的销售。(依法须批准的项目，经相关部门批准后方可开展经营活动),3
1828,002194.SZ,通讯、电子、计算机软件开发、研制、技术服务；通信设备制造；线路安装；仪器仪表、电子元器件、计算机、汽车电子零部件零售兼批发；网络信息安全、网络应用平台软硬件的研发、批发零售；自营和代理各类商品和技术的进出口(不含国家禁止或限制进出口的货物或技术)。(依法须经审批的项目，经相关部门审批后方可开展经营活动),4
1831,300069.SZ,绝缘子(包括玻璃绝缘子、陶瓷绝缘子和复合绝缘子)、高低压电器开关、插座、电线、电缆、电力金具器材的生产、销售，实业投资，投资咨询，影视策划，影视文化信息咨询，设计、制作、代理、发布国内广告，会展会务服务，组织策划文化艺术体育交流活动，工艺品、日用百货、文化用品的销售，经营文化经纪业务。(依法须经批准的项目，经相关部门批准后方可开展经营活动),5
1840,002266.SZ,电站机电设备工程总承包。(经营范围中涉及许可证书的项目凭证经营)，对外承包工程(详见《中华人民共和国对外承包工程资格证书》)。生产、加工；水轮发电机组及安装、水工机械设备、机电配件、化纤机械设备、金属结构件、电站机电设备，有色金属的销售，实业投资，经营进出口业务。水利水电技术咨询、技术服务、技术转让；(依法须经批准的项目，经相关部门批准后方可开展经营活动),5
1843,300002.SZ,计算机软硬件、网络综合管理及网络系统集成、通讯设备领域的技术开发、技术服务、技术转让、技术培训、技术推广；软件开发；软件咨询；应用软件服务；电子信息技术咨询（中介除外）；委托生产通讯设备；数据处理（数据处理中的银行卡中心、 PUE值在1.4以上的云计算数据中心除外）；销售计算机、 软件及辅助设备、通讯设备、家用电器、电子产品、安全技术防范产品；电子信息技术系统工程设计；通讯设备售后服务；技术进出口、代理进出口、货物进出口；出租办公用房； 第一类增值电信业务中的互联网接入服务业务、互联网数据中心业务； 互联网信息服务。（企业依法自主选择经营项目，开展经营活动； 互联网信息服务以及依法须经批准的项目，经相关部门批准后依批准的内容开展经营活动；不得从事本市产业政策禁止和限制类项目的经营活动）。,1
1848,002189.SZ,精密光学元件、光学镜头、数码投影产品、光伏电池模组及系统本公司及董事会全体成员保证信息披露内容的真实、准确和完整，没有虚假记载、误导性陈述或重大遗漏。应用等太阳聚能产品、光学辅料、光敏电阻、光电仪器设备等相关产品和零部件的研发、设计、生产、销售、安装和售后服务。各类光电显示设备、雷达、周界防范设备、计算机软件、电力设备、二三类机电设备、电梯、铝塑及非金属类管材(不含危化品)销售；金属表面处理及热加工处理，金属加工机械制造，非金属表面处理、加工；计算机信息系统集成服务，安全技术防范工程设计、施工、维修二级；货物和技术进出口(国家禁止或涉及行政审批的货物和技术进出口除外)(依法须经批准的项目，经相关部门批准后方可开展经营活动),3
1851,300465.SZ,开发计算机软件及配套硬件、系统集成、销售自产产品、批发机电设备产品、售后技术服务、技术咨询、承接计算机网络工程安装。,1
1852,002288.SZ,制造、加工、销售：电路板（单、双、多层及柔性电路板），电子产品，电子元器件，铜箔，覆铜板，电子模具，纸制品；货物进出口、技术进出口；投资采矿业；矿产品销售（国家专营专控的除外）；投资与资产管理、企业管理咨询（信息咨询、企业营销策划等）；动产与不动产、有形与无形资产租赁服务、 酒店及物业管理、文化体育（以工商登记为准）。,3
1863,002151.SZ,开发导航定位应用系统及软硬件产品、基于位置的信息系统、地理信息系统和产品、遥感信息系统和产品、通信系统和产品、计算机软硬件系统和产品、自动控制系统和产品、组合导航系统和产品；生产和销售开发后的产品；基于位置的信息系统的系统集成、施工、技术服务；货物进出口、技术进出口、代理进出口。房屋租赁、物业管理；导航产品试验、检测。,4
1870,300837.SZ,破碎机械、振动筛、给料机械、输送机械生产、销售、技术服务及咨询、安装及调试；货物进出口、技术进出口。(依法须经批准的项目，经相关部门批准后方可开展经营活动),2
1872,002222.SZ,光学晶体、晶体材料、激光器件的制造及其技术咨询、技术服务;对外贸易;承办对外合作生产、合资经营及“三来一补”业务。(以上经营范围凡涉及国家专项专营规定的从其规定)(以工商部门核准为准),3
1873,002407.SZ,无机盐、无机酸、助剂、合金材料及制品的生产；LED节能产品的生产；电子数码产品，锂离子电池及材料的技术开发及销售；计算机软件的开发与服务；路灯安装工程；以数字印刷方式从事出版物、包装装潢印刷品和其他印刷品的印刷业务；自营进出口业务(以上范围法律、法规禁止的，不得生产经营；应经审批的，未获审批前不得生产经营)。,0
1877,002204.SZ,机械设备设计制造、安装调试；备、配件供应；金属制品、金属结构制造；工具、模具、模型设计、制造；金属表面处理及热处理；机电设备零件及制造、协作加工；起重机械特种设备设计、制造、安装、改造、维修；压力容器设计、制造；铸钢件、铸铁件、铸铜件、铸铝件、锻件加工制造；钢锭铸坯、钢材轧制、防尘设备设计、制造、安装、调试；铸造工艺及材料技术开发；造型材料制造；货物进出口、技术进出口；房地产开发；仓储；商业贸易；工程总承包；机电设备租赁及技术开发、咨询；计算机应用；房屋建筑工程施工；机电设备安装工程；普通货运；国内货运代理；承办海上、陆路、航空国际货运代理(含报关、报验)；人工搬运；货物包装;大型物件运输。(特业部分限下属企业在许可范围内)***(依法须经批准的项目，经相关部门批准后方可开展经营活动)。,2
1878,002212.SZ,经营本企业自产产品的出口业务；经营本企业生产所需机械设备、零配件及其他原辅材料的进口业务；布电线，电力电缆，低压电器及原件，塑料制品的加工、制造； 技术开发、技术推广、技术转让、技术咨询、技术服务、技术培训；计算机系统服务；数据处理；基础软件服务、应用软件服务；销售： 电子产品、通讯设备、计算机、软件及辅助设备；生产、加工： 计算机软硬件。（依法须经批准的项目，经相关部门批准后方可开展经营活动。）,5
1880,300812.SZ,邦定机、贴片机、电子周边设备的销售；液晶设备、检测设备、自动化设备的研发与销售；兴办实业（具体项目另行申报）；信息技术开发；软件的研发与销售；智能产品的研发与销售；设备租赁（不含融资租赁活动）；国内贸易、货物及技术进出口。（法律、行政法规或者国务院决定禁止和规定在登记前须经批准的项目除外）。 邦定机、贴片机、电子周边设备的生产。,2
1881,300836.SZ,机器人及其系统集成；智能装备及其核心软、硬件的设计、制造、加工及销售；自动化设备的安装、调试、租赁；货物及技术的进出口业务。(依法须经批准的项目，经相关部门批准后方可开展经营活动)。,2
1883,002845.SZ,电子产品的技术开发、生产与销售；国内商业、物资供销业，货物及技术进出口。(以上均不含法律、行政法规、国务院决定禁止及规定需前置审批项目).,3
1885,002165.SZ,危险化学品经营（按许可证所列范围经营）； 化工产品（不含危险化学品） 的研发、销售； 塑料及塑料制品、五金交电、包装材料、 建筑材料、劳动防护用品、仪表仪器、机械设备、矿产品、工艺美术品、针纺织品、日用百货的销售； 自营和代理各类商品及技术的进出口业务（国家限定企业经营和禁止进出口的商品及技术除外）；经济信息咨询， 环保咨询，生产安全技术咨询； 电子产品研发、生产、销售及相关技术服务； 硬质喷涂和聚氨酯塑胶铺面设计和施工。,0
1886,002192.SZ,企业自有资金投资；能源管理服务；节能技术推广服务；投资管理；财务顾问；融资服务；供应链管理；管理咨询。其他有色金属矿采选；金属及金属矿批发（国家专营除外）；能源技术研究、技术开发服务。电子工业专用设备制造；电子工程设计服务；机电设备安装服务。货物进出口（专营专控商品除外）；技术进出口；商品批发贸易（许可审批类商品除外）；商品零售贸易（许可审批类商品除外）。,2
1887,002199.SZ,电子元件、计算机及网络产品、通信产品的研发、设计、生产与销售。,3
1888,002273.SZ,光学元器件制造、加工，光电子元器件制造、加工，经营本企业自产产品及技术的出口业务，经营本企业生产、科研所需的原辅材料、机械设备、仪器仪表、零配件及技术的进口业务（国家限定公司经营和国家禁止进出口的商品及技术除外），经营进料加工和“三来一补”业务，电子技术咨询服务、机械设备租赁，自有房屋租赁，物业管理，车载光学产品技术的研究、开发、应用，车载光学产品的生产、销售及相关服务，汽车电子产品、汽车零部件及配件的开发、制造、加工及其生产设备生产、销售、租赁。,3
1889,002396.SZ,互联网接入设备、网络及通讯设备、计算机、通信和其他电子设备的开发、生产、销售；自有产品租赁；网络技术及相关的互联网服务；软件开发、信息系统集成服务及相关的软件和信息技术服务；IC卡读写机具及配件、电气电源产品的开发、生产、销售；移动通信及终端设备(含移动电话、手机等)、无线通信终端、无线通信传输设备的开发、生产、销售；音视频及相关的数字服务产品的开发、生产、销售；安全技术防范监控设备及相关的社会公共安全设备的开发、生产、销售；安全技术防范系统集成业务及咨询服务；物联网技术应用与开发；家庭及公共社区智能化产品的开发、生产、销售和服务；仓储服务、供应链管理及相关配套服务；自有房屋租赁及物业管理服务。自营和代理各类商品和技术的进出口，但国家限定公司经营或禁止进出口的商品和技术除外。(依法须经批准的项目，经相关部门批准后方可开展经营活动),4
1890,300739.SZ,一般经营项目：从事信息、通讯产品的技术开发。增加:货物及技术进出口。许可经营项目：生产经营层压多层线路板；增加：生产经营精密在线测量仪器； 增加：生产经营柔性线路板。增加：载板、类载板、高密度互联积层板、高频高速板的设计、生产和销售。,3
1898,300713.SZ,计算机软件及信息技术的技术开发、咨询和销售；投资兴办实业（具体项目另行申报）；国内贸易（不含专营、专控、专卖商品）；软件产品的开发和销售（不含限制项目）。（经营范围中属于法律、行政法规、国务院决定规定应当经批准的项目，凭批准文件、证件经营。）；互联网数据中心（ IDC）设备的技术开发、生产、咨询和销售；新能源汽车配套设备的技术开发、生产、咨询和销售；电力电子产品的技术开发、生产、咨询和销售；铁路电气化设备和相关软件的开发、生产、销售、咨询与维护；新能源汽车充电站点设计开发、建设、运营与维护；可再生能源分布式发电站系统设计开发、建设、运营与维护；自动化系统、装备和相关软件的开发、生产、销售、咨询与维护；新能源汽车充电站、可再生能源分布式发电站工程施工总承包、专业承包；智能输变电、智能配用电及控制技术与设备制造；货物及技术进出口。（经营范围中属于法律、 行政法规、国务院决定规定应当经批准的项目，凭批准文件、证件经营）,5
1900,002134.SZ,印刷电路板及相关产品的生产、销售、委托加工；上述产品及同类商品和技术的研发、设计、咨询及服务；代收代付水费、电费、蒸汽费、燃气费；机械设备销售及维修；自营或代理货物及技术的进出口；自有房屋及设备租赁(依法须经批准的项目，经相关部门批准后方可开展经营活动),3
1901,002138.SZ,研发、设计、生产、销售新型电子元器件；提供技术方案设计和技术转让、咨询服务，销售自产产品。,3
1903,002137.SZ,兴办实业(具体项目另行申报)；互联网电子商务与服务、互联网信息服务、互联网投资；数据处理和数据存储服务，大数据分析及商业应用；智能照明、智能家居管理系统；软件开发、信息系统集成服务、信息技术咨询服务；电子产品、通讯产品、电器、照明灯具及其零部件的技术开发、生产、销售；国内贸易(不含专营、专控、专卖商品及限制项目)；互联网信息服务；经营进出口业务(法律、行政法规、国务院决定禁止的项目除外，限制的项目须取得许可后方可经营),4
